Question,1,2,3,Correct Answer
A settlement that has become completely abandoned is called what?,Vampire village,Ghost town,Babadook borough,Ghost town
What is the term for strolling around while not fully awake?,Perp walking,Sleepwalking,Catwalking,Sleepwalking
Which of these astronomical terms is the name of a single star?,Alpha Centauri,Rigel,Perseus,Rigel
"In Ancient Greece, a Corinthian order referred to what?",Army formation,Architecture type,Voting law,Architecture type
Which of these states is part of the New England region?,Maryland,Connecticut,New Mexico,Connecticut
Children are most likely to be dropped off in the morning at which of these places?,New York Stock Exchange,Daycare,Yacht parties,Daycare
Which of these musicals famously features a man-eating plant?,Sweeney Todd,Little Shop of Horrors,Spamalot,Little Shop of Horrors
In what country is the title character of the Where's Waldo?' franchise known as Charlie?,Germany,France,Ireland,France
The paste used to fill gaps between floor tiles is called what?,Gravel,Grout,Grundy,Grout
Laura Ingalls Wilder wrote a series of kids' books called Little House on the' what?,Garbage Island,Prairie,Volcano,Prairie
"Which of these terms describes buying a house, improving it, and selling it for profit?",Smushing,Flipping,Teleporting,Flipping
Shakespeare's wife shares her name with the star of which of these movies?,The Notebook,The Intern,Shakespeare in Love,The Intern
"Now a popular tourist destination, Elvis Presley's Memphis home goes by what name?",Palace of Song,Graceland,Rock n Roll HQ,Graceland
Gordon Lish and Maxwell Perkins are famous for working as what?,Startup founders,Book editors,Football coaches,Book editors
Which of these artists shares her given first name with her mother?,Sia,Madonna,Beyonc\xc3\xa9,Madonna
A common pass in ultimate frisbee gets its name from what mode of transportation?,Hovercraft,Elevator,Surfboard,Elevator
Which of these cities has an NBA team named for what its franchise founder manufactured?,Oklahoma City,Detroit,Denver,Detroit
Which of these animals typically walks on four legs?,Mackerel,Moose,Macaw,Moose
A right-handed person customarily wears a watch where?,Right foot,Left wrist,Belt buckle,Left wrist
Which of these websites is NOT currently officially blocked in China?,Pinterest,Reddit,Twitter,Reddit
Crying babies are often given what soothing contraption?,Fax machine,Pacifier,Vuvuzela,Pacifier
"In marketing, what does BOGO stand for?",Big old gas oven," Buy one, get one ",Belt out Gershwin operas," Buy one, get one "
Which of these authors has NOT won both a Nobel and a Pulitzer Prize?,John Steinbeck,John Updike,Toni Morrison,John Updike
Which of these foods is typically sold in aluminum cans?,Dried pasta,Creamed corn,Tortilla chips,Creamed corn
How do you calculate the sum of two numbers?,Officiate their wedding,Add them together,Heat them up,Add them together
Which of these countries does NOT use a currency with the same name as the other two?,Uruguay,Paraguay,Cuba,Paraguay
Which of these terms is a retronym?,Arcade game,Bar soap,Duck tape,Bar soap
Grapefruits were named after grapes because they both do what?,Grow on vines,Grow in clusters,Grow in same climate,Grow in clusters
"In both literature and film, Holly Golightly was famous for having breakfast where?",Under the sea,At Tiffany's,In Flavortown,At Tiffany's
Which of these is a port found on most modern computers?,TMI,USB,SMH,USB
The period of time new mothers can take off work is known as what?,Fraternity leave,Maternity leave,Eternity leave,Maternity leave
What does a red hand on an electric crosswalk sign typically mean?,High five,Stop,Talk to the hand,Stop
Which papal name has reached the highest Roman numeral?,Gregory,John,Clement,John
What gave the infamously stinky 1980s action figure Stinkor his trademark nasty smell?,Pine tar,Patchouli oil,Durian extract,Patchouli oil
Who was NOT involved in the production of Michael Jackson's film Captain EO'?,George Lucas,Steven Spielberg,Francis Ford Coppola,Steven Spielberg
"According to astronomers, which comet will reappear this century?",Comet Hale-Bopp,Halley's Comet,Caesar's Comet,Halley's Comet
"When Neil Armstrong landed on the moon, what did he famously say he took?",An epic jump,One small step,A high flip,One small step
Which of these is the name of an NFL team?,Detroit Dwaynes,Buffalo Bills,Philadelphia Freds,Buffalo Bills
"In the early 20th century, many immigrants to the US passed through what island?",Treasure Island,Ellis Island,Fantasy Island,Ellis Island
Which of these is a song in the longest-running show in Broadway history?,Endless Night,Music of the Night,Chicago After Midnight,Music of the Night
What is the capital of Turkey?,Iznik,Ankara,Istanbul,Ankara
Which of these is a classic component of the scientific method?,Voting on results,Testing hypotheses,Cherry-picking data,Testing hypotheses
What did the M' in the TV channel MTV originally stand for?,Mirth,Music,Mayhem,Music
Which of these animals typically pollinates flowers?,Flying squirrels,Honeybees,Sand sharks,Honeybees
Which of these would nutritionists most likely recommend as a healthy snack?,Big bag of sugar,Fresh fruit,Gallon of gravy,Fresh fruit
Which of these professionals would most commonly use the term ligature?,Chef,Typographer,Firefighter,Typographer
Which of these classic movie trilogies had three different directors?,Back to the Future,Star Wars IV-VI,The Godfather,Star Wars IV-VI
Which of these aquatic terms is a palindrome?,Sonar,Kayak,Tugboat,Kayak
In which of these places are you most likely to find croutons?,Babylonian bazaar,Salad bar,Cattle car,Salad bar
"According to a classic fairy tale, who ran afoul of the Three Bears?",Arnold Schwarzenegger,Goldilocks,Usain Bolt,Goldilocks
Who wrote the most Tony Award-winning musical of all time?,Elton John &amp Tim Rice,Mel Brooks,Lin-Manuel Miranda,Mel Brooks
"On average, people blink least frequently at what stage of life?",Adulthood,Infancy,Adolescence,Infancy
Whose concert do the Ninja Turtles attend in the film The Secret of the Ooze'?,Will Smith,Vanilla Ice,MC Hammer,Vanilla Ice
"What wise creature once said, Do, or do not. There is no try'?",Abraham Lincoln,Yoda,Margaret Thatcher,Yoda
"Of these three states, which has been the birthplace of the most US presidents?",Illinois,Vermont,Georgia,Vermont
Which of these terms comes from a French phrase that means come help me'?,Ahoy,Mayday,SOS,Mayday
"At the start of his career, Justin Bieber was mentored by which of these musicians?",Jay-Z,Usher,DJ Khaled,Usher
What insect lends its name to the concept that tiny actions can have massive consequences?,Ant,Butterfly,Mosquito,Butterfly
"According to official rules, in which of these games do players have to state the game's title?",Twister,Uno,Scrabble,Uno
What is the largest part of the human brain?,Hippocampus,Cerebrum,Cerebral cortex,Cerebrum
"More than 50 years after the US Revolution, what state almost went to war with England?",Virginia,Maine,New York,Maine
"Which of these is NOT the nickname of a known, real-life pirate?",Calico Jack,Billy Bones,Blackbeard,Billy Bones
What is the best letter-based grade that students can typically get on tests?,Sashay away,A+,F-,A+
In which of these classic rock songs is the title part of the lyrics?,Bohemian Rhapsody,My Generation,A Day in the Life,My Generation
"In its traditional form, which of these sauces is considered vegan?",Fish sauce,Duck sauce,Worcestershire sauce,Duck sauce
What is the correct spelling of a word that means burial ground'?,Cematery,Cemetery,Cemetary,Cemetery
What is the world-famous statue Venus de Milo famously missing?,Legs,Arms,Sense of direction,Arms
The youngest person ever nominated for an acting Oscar competed in what category?,Supporting actress,Supporting actor,Actress,Supporting actor
On what surface does the annual Albert Lee Appliance Cup take place?,Mud,Water,Ice,Water
The first upgrade to the iMac was available in five models that were all named after what?,Felines,Fruits,Stars,Fruits
Mister Rogers is known for saying which of these phrases?,Smiling equals weakness,Won't you be my neighbor,Stay chill in the chat,Won't you be my neighbor
What is the capital of the country with the world's oldest working library?,Paris,Rabat,Cairo,Rabat
Two of the Seven Wonders of the Ancient World were located in which of these modern-day countries?,Iraq,Turkey,Iran,Turkey
Which of these characters is usually shown wearing shorts?,Donald Duck,Mickey Mouse,Winnie the Pooh,Mickey Mouse
"In the classic party game, on what animal do you pin the tail?",Baleen whale,Donkey,Honey badger,Donkey
Which of these words means the opposite of deasil'?,Catty-corner,Widdershins,Clockwise,Widdershins
The first moons discovered orbiting a planet other than Earth are known as what?,Newtonian,Galilean,Copernican,Galilean
In which of these directions can most standard elevators travel?,North by northwest,Up,Left,Up
Modern automobiles typically run on which of these?,Candle wax,Gasoline,Hand-wound springs,Gasoline
What athlete has played in the championship games of both the NFL and MLB?,Bo Jackson,Deion Sanders,Brian Jordan,Deion Sanders
"By definition, which of these would you need to defenestrate' a prized belonging?",Law degree,Window,Swimming pool,Window
The works of which artist are often used to illustrate the concept of tessellation?,Claude Monet,MC Escher,Pablo Picasso,MC Escher
Which is one of the three categories of Shakespeare's plays?,Technothrillers,Tragedies,Single-camera sitcoms,Tragedies
Which breed of dog is NOT named in part for an island?,Sheltie,St. Bernard,Maltese,St. Bernard
The leading racer in the Tour de France typically wears what color?,Black,Yellow,Green,Yellow
"Muhammad Ali famously said he could float like a butterfly, sting like a' what?",Jellyfish,Bee,Personal insult,Bee
Which of these places is naturally home to penguins?,Alaska,South Africa,Mongolia,South Africa
What is NOT one of Pittsburgh's Three Rivers'?,Ohio,Beaver,Allegheny,Beaver
"If a British person asks to use your lorry,' what do they want to use?",Skateboard,Truck,Bathroom,Truck
What structure did King Kong famously climb?,Mount Everest,Empire State Building,Hogwarts,Empire State Building
"In the 1920s, a man notoriously pushed what to the top of Pikes Peak using only his nose?",Gumball,Peanut,FDR campaign button,Peanut
What US senator had a cameo in the comedy Wedding Crashers'?,Joe Lieberman,John McCain,Patrick Leahy,John McCain
In what holy location would you find the Dome of the Rock?,Mount Sinai,Temple Mount,Mount of Olives,Temple Mount
"In Richard Connell's famous short story The Most Dangerous Game,' what is being hunted?",Whale,Man,Hound,Man
Which of these roots is often used to make naturally flavored root beer?,Ginseng,Sarsaparilla,Cassava,Sarsaparilla
Which of these names is also a term that refers to a male deer?,Gary,Buck,Alfredo,Buck
Which of these is an important ingredient in making coffee?,Bike chain lubricant,Hot water,Brown mustard,Hot water
Which of these US states has the most official state songs?,West Virginia,Tennessee,Texas,Tennessee
What long-running science fiction franchise began aboard the spacecraft Nostromo?,Star Trek,Alien,Planet of the Apes,Alien
"Of the US presidents born in the 20th century, who held office first?",Dwight D. Eisenhower,John F. Kennedy,Lyndon B. Johnson,John F. Kennedy
What fruit is also sometimes known as a fuzzless peach'?,Orange,Nectarine,Pomegranate,Nectarine
Which of these species is the closest relative of the llama?,Hamster,Alpaca,Rhinoceros,Alpaca
A dinner combining seafood and red meat is called surf and' what?,Smurf,Turf,Nerf,Turf
Which of these body parts is also a common part of a chair?,Spleen,Leg,Uvula,Leg
The arrow next to the gas gauge on a car dashboard is designed to point to what?,Oil gauge,Filler cap,Trunk,Filler cap
What is the name of the imaginary line at zero degrees latitude?,Prime Meridian,Equator,Tropic of Capricorn,Equator
Michael Jackson was known as the King of what?,Breakfast,Pop,Bahrain,Pop
The actor behind which Fresh Prince' character also had a long career voicing cartoon villains?,Carlton,Philip,Geoffrey,Philip
Which of these cities' NBA teams has a bird as a mascot?,Memphis,New Orleans,Charlotte,New Orleans
Eliza Schuyler Hamilton helped raise money to build what DC landmark?,Jefferson Memorial,Washington Monument,Ford's Theater,Washington Monument
Which of these fabrics is most closely associated with picnics?,Tulle,Gingham,Seersucker,Gingham
What butler' lent his name to a popular 1'0s search engine?,Mr. Belvedere,Jeeves,Malcolm,Jeeves
The word flauta' literally translates to what in English?,Flimsy taco,Flute,Flux capacitor,Flute
What European mountain range is named for its visibility to incoming American ships?,Pecos Bill,Picos de Europa,Pico de Gallo,Picos de Europa
In which of these terms does the initial refer to the name of an emperor?,W-2,C-Section,Q Rating,C-Section
Which of these words has won Oxford Dictionaries Word of the Year?,Hundo,Unfriend,Yassss,Unfriend
What term refers to diving headfirst into a pool with arms wide open at the start?,Pig dive,Swan dive,Moose dive,Swan dive
"If your clothes catch fire, you are supposed to stop, drop, and what?",Think,Roll,Freak,Roll
The element named from the Latin for flint' is typically used to make what?,Explosives,Computer chips,Electrical wire,Computer chips
A rack-and-pinion' assembly relies on what mechanical concept?,Hydraulics,Gears,Springs,Gears
Which of these is a common office supply?,Clown shoes,Paper clips,Heated asphalt,Paper clips
The last lines spoken by Shakespeare's Romeo and Othello both include what word?,Sleep,Kiss,Heart,Kiss
Whose Twitter handle comes first in alphabetical order?,Ellen DeGeneres,Neil Patrick Harris,LeBron James,Neil Patrick Harris
What does the A' in the biological acronym DNA' stand for?,Ardent,Acid,Adenine,Acid
The New York Daily Advertiser was a newspaper famous for publishing what?,First US coupons,Federalist Papers,Classifieds,Federalist Papers
What billionaire runs the corporate behemoth Berkshire Hathaway?,Michael Bloomberg,Warren Buffett,Charles Koch,Warren Buffett
The comic strip B.C.' is mainly about what?,Aliens,Cavemen,Robots,Cavemen
Two items that are difficult to compare are often said to be what?,Hoagies / grinders,Apples / oranges,Simons / Garfunkels,Apples / oranges
"In the world of comic books, what does retcon' mean?",Retouched condition,Retroactive continuity,Retaliatory concussion,Retroactive continuity
Which of these college football teams famously has the largest stadium?,Crimson Tide,Wolverines,Longhorns,Wolverines
"On the periodic table of the elements, what are the horizontal rows called?",Groups,Periods,Blocks,Periods
Which of these places is located in the tropics?,Siberia,Hawaii,Antarctica,Hawaii
Which of these dog breeds has won the most Best in Show awards at Westminster?,English Setter,Scottish Terrier,Bichon Frise,Scottish Terrier
Which of these properties is often measured in fluid ounces?,Density,Volume,Viscosity,Volume
The only dwarf planet in our solar system's asteroid belt is named for a goddess of what?,Wisdom,Agriculture,Dawn,Agriculture
Which Canadian author wrote a book nobody will be able to read until the next century?,Alice Munro,Margaret Atwood,Yann Martel,Margaret Atwood
What school shares its name with a character from the legends of King Arthur?,Emory University,Notre Dame,Columbia University,Notre Dame
Which of these US states is part of the Delmarva Peninsula?,Arkansas,Maryland,Arizona,Maryland
Which of these brands does NOT have a designer contracted for life?,Chanel,Gucci,Fendi,Gucci
Which of these is a right granted by the Sixth Amendment?,Private trial,Public trial,Trial without a jury,Public trial
Which of these terms means common people'?,Perth Amboy,Hoi polloi,Bok choy,Hoi polloi
What is the name of the first book of the Christian Bible?,The Sorcerer's Stone,Genesis,Fellowship of the Ring,Genesis
Which of these irons is a common heat-styling tool for hair?,Jeremy,Curling,Cast,Curling
Bob Marley's son performs the theme song for a hit animated TV show about a talking what?,Sponge,Aardvark,Horse,Aardvark
Which of these places named its capital after John the Baptist?,Cuba,Puerto Rico,The Bahamas,Puerto Rico
What is the name of the traditional Japanese art form that combines dancing and theater?,Surfboarding,Kabuki,Pattycake,Kabuki
Which of these veteran filmmakers has directed an R-rated movie?,Chris Columbus,Nancy Meyers,JJ Abrams,Nancy Meyers
"Bessie, the US equivalent to the Loch Ness monster, is rumored to live in what lake?",Superior,Erie,Ontario,Erie
"By definition, an expert in amanuensis is helpful in what?",Administering shots,Writing letters,Cleaning lab equipment,Writing letters
Which of these typically stores sweet treats?,Jacuzzi,Cookie jar,Shrimp boat,Cookie jar
The duration of a pregnancy is usually measured in what?,Laughter,Trimesters,Cups of decaf,Trimesters
Which US president did NOT win a Nobel Peace Prize?,Woodrow Wilson,Franklin Roosevelt,Teddy Roosevelt,Franklin Roosevelt
Which of these terms refers to the outer region of the Sun's atmosphere?,Tacoma,Corona,Zygoma,Corona
"By definition, numbers that are less than zero are classified as what?",Imaginary,Negative,Transcendental,Negative
Clothes normally go from a washing machine to what other machine?,Fax,Dryer,ATM,Dryer
Paul Newman is mentioned in the first line of what novel?,The Hustler,The Outsiders,Get Shorty,The Outsiders
Boss of Me' by They Might Be Giants was the theme song to what sitcom?,30 Rock,Malcolm in the Middle,The Office,Malcolm in the Middle
Author Ian Fleming created what spy code-named 007?,Spyler the Creator,James Bond,Spyin' Gosling,James Bond
Charles Darwin was born on the same exact date and year as which president?,Thomas Jefferson,Abraham Lincoln,Theodore Roosevelt,Abraham Lincoln
Which of these religious movements was founded by a woman?,Jehovah's Witnesses,Christian Science,Rastafari,Christian Science
Which singer's daughter was once the creative director of French fashion house Chlo\xc3\xa9?,Steven Tyler,Paul McCartney,David Bowie,Paul McCartney
You would find a cloaca in the digestive system of which of these animals?,Caterpillar,Chameleon,Chimpanzee,Chameleon
Which of these is another word for another word for'?,Zimmerman,Synonym,Cinnamon,Synonym
"In Psy's viral 2012 song from South Korea, the term oppa' loosely translates to which of these?",Big time,Big brother,Big spender,Big brother
Which state is home to a NASA facility named for the 35th US president?,Texas,Florida,Virginia,Florida
Which of these is also known as the devil's game'?,Blackjack,Roulette,Poker,Roulette
The director of the horror classic Scream' also directed which film?,Mr. Holland's Opus,Music of the Heart,School of Rock,Music of the Heart
Which of these major ancient cities was located the farthest north?,Carthage,Lutetia,Byzantium,Lutetia
Legendary NBA player Larry Bird went on to coach what team?,Boston Celtics,Indiana Pacers,Los Angeles Lakers,Indiana Pacers
Which of these synonyms for large' was coined most recently?,Prodigious,Humongous,Ginormous,Humongous
"In The Silence of the Lambs,' Hannibal Lecter paired his fava beans with a wine from what country?",France,Italy,Argentina,Italy
A police officer can search your house without a warrant if they have what cause?,Notable,Probable,Acute,Probable
A house in need of repairs and remodeling is known as what?,Tree-plugger,Fixer-upper,Trash can-lugger,Fixer-upper
Dirty water dog' is a New York City nickname for what edible street food?,Spaghetti,Hot dog,Mushroom soup,Hot dog
"Where was Richard Nixon speaking when he famously declared, I am not a crook'?",Knott's Berry Farm,Disney World,SeaWorld,Disney World
The so-called Billionaire Boys Club' of the 1980s got rich quick through what?,Penny stocks,Ponzi schemes,Junk bonds,Ponzi schemes
What singer shares a name with a bygone empire headquartered in Ghana?,Shakira,Ashanti,Aaliyah,Ashanti
Which of these actors is famous for the classic movie line I'm walkin' here!'?,Robert De Niro,Dustin Hoffman,Al Pacino,Dustin Hoffman
"According to the creator, which of these classic characters is actually NOT a cat?",The Cat in the Hat,Hello Kitty,Felix the Cat,Hello Kitty
Fancy Scotch whisky is often described as single' what?,Match,Malt,Mash,Malt
Uprooted thistle plants that are driven about by the wind are known as what?,Fumbleseeds,Tumbleweeds,Stumbletweeds,Tumbleweeds
"According to its inventor, the graphics format spelled G-I-F is pronounced how?",gif',jif',zhif',jif'
"What does brimstone,' as mentioned in the Bible, refer to?",Granite,Sulfur,Lava,Sulfur
The tiny country of Liechtenstein borders what two nations?,France / Germany,Austria / Switzerland,Belgium / Netherlands,Austria / Switzerland
What computational device predates pocket calculators by thousands of years?,Desktop computer,Abacus,Slide rule,Abacus
Which of these actors does NOT have their own brand of wine?,Kate Hudson,Anne Hathaway,Drew Barrymore,Anne Hathaway
What is the nickname of the NHL player with the record for most games ever played?,Mr. Goalie,Mr. Hockey,Mr. Invincible,Mr. Hockey
The warning that police give arrested suspects are known as what rights'?,Samantha,Miranda,Charlotte,Miranda
The Earth is covered in about 70 percent what?,Leather,Water,Frank Ocean,Water
Soup is typically eaten with what kind of kitchen utensil?,Toothpick,Spoon,Meat thermometer,Spoon
Which of these insects is typically the heaviest by far?,Giant weta,Goliath beetle,Rhinoceros cockroach,Goliath beetle
A 2017 hack of the Harvard Crimson' front page made fun of what celebrity?,Malia Obama,Mark Zuckerberg,Natalie Portman,Mark Zuckerberg
Which of these is a real zodiac sign?,Equinox,Taurus,Nova,Taurus
"Typically, what kind of sauce is on a cheese pizza?",Glue,Tomato,Paint,Tomato
A founder of publishing house Simon &amp Schuster is the parent of a famous what?,Architect,Singer,Athlete,Singer
Which of these enlightenment philosophers also wrote a ridiculously steamy novel?,John Locke,Denis Diderot,Ren\xc3\xa9 Descartes,Denis Diderot
Which US federal tax return form is known as the short' one?,Form 1040,Form 1040A,Form 1040EZ,Form 1040A
Surviving the Titanic earned Molly Brown what nickname?,Unforgettable,Unsinkable,Unbreakable,Unsinkable
A popular card game involves telling your opponent to do what?,Get a job,Go fish,Go get me a coffee,Go fish
Which of these is one of the four cardinal directions on a compass?,Chicago West,North,NCIS: New Orleans,North
Which is the INCORRECT pairing of actress to Golden Girl'?,Rue / Blanche,Betty / Sophia,Bea / Dorothy,Betty / Sophia
What playwright wrote Macbeth'?,Tommy Wiseau,William Shakespeare,Lin-Manuel Miranda,William Shakespeare
The term blog' is short for what?,Back-linking of guests,Web log,Bluetooth object gate,Web log
What does a thermometer primarily measure?,Hope,Temperature,Distance,Temperature
Which candy company's name was formed from its founder's name and home city?,Hershey,Haribo,Necco,Haribo
Which of these hit '80s songs is NOT by a band whose name is a continent?,Heat of the Moment,Eye of the Tiger,The Final Countdown,Eye of the Tiger
A famous Emily Dickinson poem compared which of these phenomena to a bee?,Hope,Fame,Joy,Fame
What classic game features a piece called a spinner?,Tiddlywinks,Dominoes,Jacks,Dominoes
Which is both a type of subatomic quark particle and a Motorola smartphone?,Spice,Charm,Up,Charm
Dr. Charles Drew's greatest contribution to medicine was in what area?,Cardiology,Hematology,Osteology,Hematology
Which of these songs does NOT have the same melody as the other two?,The Alphabet Song,Fr\xc3\xa8re Jacques,Baa Baa Black Sheep,Fr\xc3\xa8re Jacques
The first beta blocker was developed to treat what ailment?,Sinus infection,Chest pain,High blood pressure,Chest pain
"According to ancient Rome's iconic epic, what hero was hidden inside the Trojan Horse?",Hercules,Ulysses,Achilles,Ulysses
What do candles on a birthday cake traditionally represent?,Number of friends,Age,Love of fire,Age
Which has NOT been the name of an Android operating system?,Jelly Bean,Butterscotch,Froyo,Butterscotch
Which popular game uses a doubling cube?,Bunco,Backgammon,Yahtzee,Backgammon
What character appears on stickers that warn children of poisons?,Mr. Yum,Mr. Yuk,Mr. D. Lishus,Mr. Yuk
Which of these is a real title from the Mr. Men' book series?,Mr. Thoughtful,Mr. Nonsense,Mr. No,Mr. Nonsense
White precipitation that falls from the sky is called what?,Bordeaux,Snow,Henry David Thoreau,Snow
Who has NOT hosted an edition of the science miniseries Cosmos'?,Neil deGrasse Tyson,Bill Nye,Carl Sagan,Bill Nye
Which of these is designed to make easily erasable marks?,Tattoo needle,Pencil,Permanent marker,Pencil
A restaurant dish that is prepared when you order it is said to be cooked how?,A la plancha,A la minute,A la carte,A la minute
Which of these professionals is most likely to claim to have ESP?,Lifeguard,Psychic,Gym teacher,Psychic
Which sport does NOT use an official who is officially referred to as a referee'?,Hockey,Baseball,Football,Baseball
Ransom Riggs's debut novel was adapted into a movie by what director?,Richard Linklater,Tim Burton,Guillermo del Toro,Tim Burton
Which of these common food additives comes from the ocean?,Guar gum,Carrageenan,Pectin,Carrageenan
Which US state has a capital city with an American Indian name?,Arizona,Florida,North Dakota,Florida
What is applied to unpopped corn to pop it?,Peer pressure,Heat,Nail polish,Heat
"According to a famous saying, a journey of a thousand miles begins with a single' what?",Energy drink,Step,Ride-hailing app,Step
