Question,1,2,3,Correct Answer
Which classic arcade game character often defeated enemies by overinflating them?,Major Havoc,Pengo,Dig Dug,Dig Dug
"In baseball, which is NOT a way the batter can advance to first base?",Dropped third strike,Hit by pitch,Stealing,Stealing
Which award does Bob Dylan have the most of?,Nobels,Oscars,Grammys,Grammys
"After a wedding, a bride traditionally throws a bouquet of what?",Thank-you cards,Rice,Flowers,Flowers
An old proverb tells us home is where' what body part is?,Spleen,Pinkie toe,Heart,Heart
"As a child, John Mayer was inspired to learn guitar because of which film?",Wayne's World,The Blues Brothers,Back to the Future,Back to the Future
"Before modern welding techniques, what tool was traditionally used to work metal?",Chervil,Weevil,Anvil,Anvil
The star of Dances With Wolves' appeared in early marketing for which of these companies?,Dell,HP,Apple,Apple
Nitrous oxide is most likely to be used in which of these places?,Soda bottling plant,Nail salon,Dentist's office,Dentist's office
"According to Martha Stewart, which of these bed linens goes between the other two?",Fitted sheet,Duvet,Top sheet,Top sheet
"Who produced, directed, and starred in Citizen Kane'?",Victor Fleming,Frank Capra,Orson Welles,Orson Welles
Who was the first leader of the Holy Roman Empire?,Chamillionaire,Pusha T,Charlemagne,Charlemagne
What is the boiling point of water at sea level?,Traffic jam,Being asked to work late,212\xc2\xb0 Fahrenheit,212\xc2\xb0 Fahrenheit
Which fashion designer once worked at Vogue' as an editor?,Michael Kors,Carolina Herrera,Vera Wang,Vera Wang
Which of these classic hip-hop songs explicitly mentions brunch?,C.R.E.A.M.,Gin and Juice,Juicy,Juicy
The Secret Life of Alex Mack' aired on the same network as which other show?,Lizzie McGuire,Powerpuff Girls,Zoey 101,Zoey 101
Which of these is the name of a 19th-century US political party?,Dhress,Pahnts,Whig,Whig
Which country has the longest total coastline?,Australia,Russia,Canada,Canada
Who was the first female co-host on a national US morning TV show?,Diane Sawyer,Oprah Winfrey,Barbara Walters,Barbara Walters
The title of the former official Soviet Union Communist Party newspaper translates to what?,Justice,Honor,Truth,Truth
What motto is found on American coins and paper currency?,Greed Is Good,Where's the Beef?,In God We Trust,In God We Trust
Which country has hosted an Olympics but NOT a FIFA World Cup?,Sweden,South Korea,Greece,Greece
Which of these superstars used to go by the name Stefani?,Nicki Minaj,Cardi B,Lady Gaga,Lady Gaga
What word describes a male horse younger than four years old?,Accountant,Uncle Tony,Colt,Colt
"According to Merriam-Webster, which of these controversial words is the oldest?",Conversate,Irregardless,Firstly,Firstly
Which letter is the least commonly used to start words in the English language?,Z,Q,X,X
The classic novel Swiss Family Robinson' was primarily set where?,Switzerland,Sweden,Desert island,Desert island
Which of these miles is the longest in length?,Mile,Nautical mile,Geographical mile,Geographical mile
Which state does NOT have a Universal Studios?,California,Florida,New York,New York
What country name is a common synonym for fancy porcelain dinnerware?,Canada,Croatia,China,China
The jokey name Roy G. Biv is helpful for remembering what?,Amendments,Animal classifications,Rainbow colors,Rainbow colors
Which of these is a common topping for pancakes?,Duvet cover,Corned beef sandwiches,Syrup,Syrup
Which of these caped characters was introduced first?,Batman,Superman,Zorro,Zorro
Which NBA franchise has NOT won a championship in the 21st century?,Los Angeles Lakers,Boston Celtics,Chicago Bulls,Chicago Bulls
Which of these instruments typically has six strings?,Piano,Harp,Guitar,Guitar
Which of these countries contains the greatest number of states?,Mexico,India,United States,United States
Which of these Seven Wonders of the Ancient World might never have been built?,Statue of Zeus,Temple of Artemis,Hanging Gardens,Hanging Gardens
Kentucky's famous Hot Brown sandwich gets its name from what?,Type of mustard,State governor,Hotel,Hotel
Which of these states' capitals shares its name with the hometown featured in The Simpsons'?,Massachusetts,Ohio,Illinois,Illinois
A method of growing plants without soil goes by which of these names?,Hydraulics,Hydronics,Hydroponics,Hydroponics
In-line skates are also known as what?,Weebles,Spinderellas,Rollerblades,Rollerblades
The mantidae family of insects is better known by what name?,Shopping mantis,Tweeting mantis,Praying mantis,Praying mantis
"According to an old English saying, To err is' what?",Divine,Forgivable,Human,Human
"According to his original profile on the site, where did Tom from MySpace live?",San Jose,San Francisco,Santa Monica,Santa Monica
Which actor has starred in two different movies about Pocahontas?,Jason Alexander,Colin Farrell,Christian Bale,Christian Bale
"In fencing, the foil is meant to hit what body part?",Head,Arms,Torso,Torso
Which Harry Potter character is NOT referred to in a title of a Harry Potter book?,Sirius Black,Severus Snape,Voldemort,Voldemort
Which of these was banned by the federal US government most recently?,Gin,Ulysses' by James Joyce,Sliced bread,Sliced bread
An ad for a car dealership inspired the name of which classic cartoon character?,Beetle Bailey,Archie,Odie,Odie
Which of these states did NOT name the bolo tie as official state neckwear?,New Mexico,Arizona,Oklahoma,Oklahoma
"In the business world, IPO stands for initial public' what?",Opportunity,Orchestration,Offering,Offering
Which of these snakes is venomous?,Boa constrictor,Burmese python,Black mamba,Black mamba
Which flavor is traditionally included in Neapolitan ice cream?,Mint chocolate chip,Mango,Strawberry,Strawberry
"In RVs, the powerful hitch that connects the vehicle to a towing car is known as what?",Spinster,Singleton,Fifth wheel,Fifth wheel
Which of these animals is a bovine?,Cat,Dog,Ox,Ox
The director of what film once appeared as an Elvis impersonator on Golden Girls'?,Blue Velvet,Apocalypse Now,The Hateful Eight,The Hateful Eight
A stag party is the British equivalent of what American event?,Birthday party,Graduation party,Bachelor party,Bachelor party
What device is often used to take someone's temperature?,Thingamajig,Turkey baster,Thermometer,Thermometer
"To help the environment, a common phrase suggests you should reduce, reuse, and what?",Remix,Reply all,Recycle,Recycle
Which state's capital comes first in alphabetical order?,Nevada,New Hampshire,North Dakota,North Dakota
Which of these is NOT an event in the Olympic heptathlon?,800-meter run,Shot put,100-meter dash,100-meter dash
The laces of a shoe go through a part called the what?,Medallion,Porthole,Eyelet,Eyelet
Who was the first performer to have a No. 1 movie and album in the same week in the US?,Eminem,Will Smith,Jennifer Lopez,Jennifer Lopez
Which of these novels did NOT win the Pulitzer Prize for Fiction?,The Road,The Goldfinch,The Corrections,The Corrections
"In American Sign Language, hooking your index fingers together and then switching them means what?",Savage,Never,Friend,Friend
Which of these is a real hybrid fruit?,Watermumpkin,Avotato,Limequat,Limequat
The Richter scale measures what kind of seismic event?,Birthday cakes,Mirth lakes,Earthquakes,Earthquakes
"In John Steinbeck's classic book Travels with Charley,' Charley is Steinbeck's what?",Father,Car,Pet,Pet
"Until the 1950s, the biggest island in the world was considered a colony of what country?",The UK,Canada,Denmark,Denmark
Which of these is the title of a film that stars Sinbad as a genie?,Kazaam,Shazaam,Neither,Neither
Which of these chemical elements is often used to fill party balloons?,Holmium,Hydrogen,Helium,Helium
"What is the general term for a digital, downloadable spoken-word audio recording?",Fraudcast,Scottcast,Podcast,Podcast
Which of these films was adapted from a novel written by the founder of a religion?,Eyes Wide Shut,Crash,Battlefield Earth,Battlefield Earth
A visit to which of these tall buildings will put you closest to Australia?,Lotte World Tower,Burj Khalifa,Ping'An Finance Centre,Ping'An Finance Centre
Which Broadway musical was reportedly the first to feature a wheelchair-bound actor?,Rent,Hamilton,Spring Awakening,Spring Awakening
"Cuticle, cortex and medulla are all components of what human body part?",Eyeballs,Nails,Hair,Hair
How do you measure square footage?,Divide height by width,Add depth to width,Multiply length by width,Multiply length by width
A well-known number series is named for which of the following mathematicians?,Euler,Gauss,Fibonacci,Fibonacci
Which of these world-historical figures was born first?,Archimedes,Cleopatra,Alexander of Macedonia,Alexander of Macedonia
What is Canada's one-dollar coin commonly called?,Bucky,Dollop,Loonie,Loonie
What legendary underdog defeated Goliath in an ancient Biblical fight?,Ambrose,Chet,David,David
The initialism FYI usually stands for For your' what?,Improv group,Igloo,Information,Information
"In a classic children's joke, why is 6 afraid of 7?",6 owes 7 money,6 misunderstood 7's text,Because 7 ate 9,Because 7 ate 9
Which of these early groups of hominids lived on Earth first?,Homo erectus,Homo heidelbergensis,Homo habilis,Homo habilis
Which of these is NOT the name of one of Mexico's 31 states?,Chihuahua,Tabasco,Pi\xc3\xb1ata,Pi\xc3\xb1ata
A short period of time can be referred to with which phrase?,Chicago blink,Dallas instant,New York minute,New York minute
Which of these accessories is typically worn lowest on the body?,Brooch,Bracelet,Anklet,Anklet
The state of New Mexico has an official question that asks to choose between what?,Directions,Animals,Colors,Colors
Which of these words is NOT a synonym for monkey business'?,Shenanigans,Skullduggery,Smithereens,Smithereens
"According to an old saying, teaching a person to fish will feed them for how long?",3 to 5 business days,6 seconds,A lifetime,A lifetime
"During my appearance on  The Voice' tonight, which coach did the camera cut away to?",Alicia Keys,Kelly Clarkson,Blake Shelton,Blake Shelton
The vast majority of the Serengeti National Park is located in which country?,Kenya,Uganda,Tanzania,Tanzania
"As used in emergency medicine, what is the term stat' short for?",Stator,Staten,Statim,Statim
Which movie series' music was NOT composed by John Williams?,Indiana Jones,Harry Potter,Back to the Future,Back to the Future
"If you put on a hoodie, what type of clothing are you wearing?",Cloak,Cape,Sweatshirt,Sweatshirt
Which is NOT one of the three main types of rock?,Sedimentary,Metamorphic,Rhyolite,Rhyolite
A long-running line of '80s ads urged potential pizza customers to avoid' what?,Being annoyed,Big Floyd,The Noid,The Noid
What century refers to the same time period as the phrase the 1800s'?,17th century,18th century,19th century,19th century
Which is a common building material for chairs?,Football kickers,Fruit stickers,Wicker,Wicker
"In addition to her well-known dragon, famous literary character Lisbeth Salander has which other tattoo?",Scorpion,Flame,Wasp,Wasp
Which of these 1980s Tom Cruise movies is based on a novel?,Top Gun,Rain Man,Cocktail,Cocktail
Which of these bands does NOT have a female founding member?,Talking Heads,Sonic Youth,Simple Minds,Simple Minds
What writer was labeled as not having hope' by her teachers at seminary school?,Jane Austen,Mary Shelley,Emily Dickinson,Emily Dickinson
"Traditionally, a tattoo featuring which of these meant that a sailor had crossed the equator?",Anchor,Bottle,Turtle,Turtle
Which of these fictional kings has giant ears and a trunk?,Aslan,Aragorn,Babar,Babar
Which of these countries gained its independence most recently?,Ghana,Guinea,Grenada,Grenada
Which of these words is NOT a portmanteau?,Endorphin,Chortle,Gelato,Gelato
"Before Seinfeld,' Larry David and Michael Richards both worked on what live comedy TV show?",Saturday Night Live,SCTV,Fridays,Fridays
Which of these figures is a famous composer?,Seymour Glass,Ira Glass,Philip Glass,Philip Glass
What punctuation mark best introduces a list within a sentence?,Semicolon,Hyphen,Colon,Colon
Ducks are known for making which of these sounds?,Quadrillion,Quavo,Quack,Quack
Which of these bands has a lead singer who is literally named Savage?,My Morning Jacket,Arcade Fire,Parquet Courts,Parquet Courts
Which of these countries' flags does NOT feature a large circle?,Laos,Brazil,Croatia,Croatia
What food is thought to get its name from resembling a dachshund?,Bagel,Couscous,Hot dog,Hot dog
Which of these is both a current world leader and a diacritical mark?,Cedilla,Modi,Macron,Macron
"According to mathematical terminology, what shape' is the number 28?",Octagonal,Square,Triangular,Triangular
Earth's tallest known living tree is located closest to which of these cities?,Kathmandu,Rio de Janeiro,Sacramento,Sacramento
"In the board game Othello, also known as Reversi, what pieces may NOT be flipped?",Edge pieces,Center pieces,Corner pieces,Corner pieces
Which of these inner planets is typically hotter than the others?,Mars,Mercury,Venus,Venus
In which European country did Kim Jong-un attend boarding school?,Monaco,England,Switzerland,Switzerland
JK Rowling has also written books under what first name?,Joanna,Kasey,Robert,Robert
Which of these celebrities does NOT go by his middle name?,Bruce Willis,Ashton Kutcher,Justin Timberlake,Justin Timberlake
Which of these baseball pitches puts the least spin on the ball?,Curveball,Fastball,Knuckleball,Knuckleball
Pitch-correction technology is better known by what name?,Pitchy Dawg,Sing Sing,Auto-Tune,Auto-Tune
What do the first two letters in PE teacher' stand for?,Pizza Eater,Party Expert,Physical Education,Physical Education
Which of these Broadway musicals was NOT adapted from a film?,Kinky Boots,The Producers,Grease,Grease
The area of Las Vegas Boulevard with the city's biggest hotels is commonly referred to as what?,Mordor,Diagon Alley,The Strip,The Strip
Which of these is NOT one of the five basic human senses?,Touch,Smell,Impending doom,Impending doom
Which of these atomic building blocks is the least massive?,Neutron,Proton,Electron,Electron
Which of these words does NOT appear in the title of a Dr. Seuss book?,Kwuggerbug,Wocket,Biffle,Biffle
Which of these Sanrio characters is a family member of Hello Kitty's?,Dear Daniel,My Melody,Mimmy,Mimmy
Which of these US states does NOT border both Florida and Tennessee?,Georgia,Alabama,Mississippi,Mississippi
Bowling balls are mainly designed to knock down what?,Spools,Needles,Pins,Pins
Many US states have laws requiring dogs in public places to be on what?,Cloud nine,Social media,Leashes,Leashes
What object is displayed on the national flag of Portugal?,Orrery,Astrolabe,Armillary sphere,Armillary sphere
What song on the Hamilton' soundtrack shares its title with an Ariana Grande single?,You'll Be Back,Burn,One Last Time,One Last Time
Which of these would you typically use trigonometry to measure?,Mortgage interest,Larry King's age,Height of a tree,Height of a tree
Where do clouds most often appear?,The bottom of wells,On the ocean floor,In the sky,In the sky
Jackie Robinson played his minor league baseball home games in what city?,Jersey City,Brooklyn,Montreal,Montreal
Which of these is mentioned last in the original Law &amp Order' intro?,District attorneys,Police,Offenders,Offenders
Which of these international landmarks is located farthest north?,Statue of Liberty,Taj Mahal,Leaning Tower of Pisa,Leaning Tower of Pisa
Which of these bands titled its debut album with just a number?,Nirvana,Stone Temple Pilots,Pearl Jam,Pearl Jam
Which of these Triple Crown-winning horses ran the Kentucky Derby the fastest?,War Admiral,American Pharoah,Seattle Slew,Seattle Slew
For what object did Time' magazine bend the rules for its Person of the Year' award?,Mirror,Television,Computer,Computer
"When used as a slang term for money, how much is a rack'?",$20.00,$100.00,"$1,000.00","$1,000.00"
The speed of sound is named for what Austrian physicist?,Hans Warp,Klaus Z\xc3\xbcm,Ernst Mach,Ernst Mach
In what sport would you most likely use the term bullseye'?,Golf,Shuffleboard,Darts,Darts
The company whose stock symbol is simply V' mainly provides which of these?,Phone services,Cable TV,Financial services,Financial services
Which of these people served as vice president under the person on the US $50 bill?,Aaron Burr,Andrew Johnson,Henry Wilson,Henry Wilson
Which of these MLS soccer teams does NOT play its home games in the US?,Sounders,Timber,Impact,Impact
Which phrase consists of two football terms AND describes an arrangement of pulleys?,Snap and line,Punt and down,Block and tackle,Block and tackle
Which of these divisions of geologic time is the shortest?,Era,Epoch,Age,Age
A centuries-old game called Captain's Mistress' is now often sold under what name?,Battleship,Yahtzee,Connect Four,Connect Four
With which of the following artists has Sting NOT recorded a song?,Rod Stewart,Shaggy,Michael Bolton,Michael Bolton
"In Greek mythology, who abandoned his mother and sister to fight alongside the Trojans?",Achilles,Odysseus,Ares,Ares
Which of these did Beyonc\xc3\xa9 use to announce her first pregnancy?,Her official website,Instagram,Awards show,Awards show
Which of these sci-fi movie titles is also a scientific term that applies to black holes?,Ex Machina,Solaris,Event Horizon,Event Horizon
What animal's kid is literally called a kid'?,Sheep,Kangaroo,Goat,Goat
"What cartoon character repeatedly perishes on South Park,' only to return every time?",Darkwing Duck,Jon Snow,Kenny,Kenny
What is the real name of the co-founder of Cash Money Records?,Dwayne Carter,Sean Combs,Bryan Williams,Bryan Williams
What is the name of the robot that has spent more than 10 Earth years exploring Mars?,Spirit,Pathfinder,Opportunity,Opportunity
Association football' is the British term for a sport typically known as what in the US?,Football,Rugby,Soccer,Soccer
Which of these titles typically wields the most power at a corporation?,CIO,CFO,CEO,CEO
"The phrase always a bridesmaid, never a bride' was popularized by an ad campaign for what?",Detergent,Lingerie,Mouthwash,Mouthwash
Which of these nations shares a border with Italy?,Serbia,Slovakia,Slovenia,Slovenia
The two sides of the Great Wall of China face China and what?,Russia,Mongolia,China,China
Which of these dogs is thought to NOT get its name from its color?,Chocolate Lab,Golden Retriever,Greyhound,Greyhound
"In publishing, what is typically found next to verso'?",Bolus,Menta,Recto,Recto
"Though they all ended quickly, which of these late-night hosts had the shortest run?",Magic Johnson,Pat Sajak,Chevy Chase,Chevy Chase
Which of these is actually in the country of Scotland?,County of Scotland,Scotland Yard," Skye, Scotland "," Skye, Scotland "
From where did the Titanic originally set sail?,United States,England,Northern Ireland,Northern Ireland
Another way to express the number 1000 is to write ten to the' what?,Thousandth power,Tenth power,Third power,Third power
What was the name of the wrestling giant who starred in The Princess Bride'?,Gerry,Mitch,Andr\xc3\xa9,Andr\xc3\xa9
Which city is NOT a terminus of the Panama Canal?,Col\xc3\xb3n,Panama City,La Chorrera,La Chorrera
What classic video game was partly designed by founders of Apple Computer?,Defender,Asteroids,Breakout,Breakout
Which of these is both a body part and the phonetic pronunciation of a letter in the Hebrew alphabet?,Gimel,Heel,Shin,Shin
Which sport does NOT have a US Open?,Tennis,Golf,Handball,Handball
Which of these is the name of the ship that famously brought the Pilgrims to America?,Pacific Princess,SS Minnow,Mayflower,Mayflower
Which of these is a character from the 1980s cartoon series titled Ghostbusters'?,Slimer,Ray Stantz,Eddie Spenser Jr.,Eddie Spenser Jr.
Which of these states is home to the tallest structure in the Western Hemisphere?,Washington,New York,North Dakota,North Dakota
What is the capital of the North Star State?,Austin,Juneau,Saint Paul,Saint Paul
"When referring to the rodent, which of these is the correct plural form of mouse'?",Mouses,Octopi,Mice,Mice
A person who can't decide something is said to be sitting on the' what?,Blockchain,Dock of the bay,Fence,Fence
The final words of which famous poem are written in the Sanskrit language?,Ozymandias,The New Colossus,The Waste Land,The Waste Land
Which cartoon character made his first TV appearance in an ad for a fruit juice?,Squidward Tentacles,Snoopy,Doug Funnie,Doug Funnie
"By definition, a hotel room advertised as having AC has what?",Alive cockroaches,Almond cookies,Air conditioning,Air conditioning
Which of these is the title of only one book of the Bible?,Kings,Chronicles,Judges,Judges
Which of these is NOT one of Switzerland's official languages?,French,Italian,Dutch,Dutch
Which of these is considered higher' mathematics?,Arithmetic,Area of a square,Vector calculus,Vector calculus
Which of these islands is in the Caribbean?,Bora Bora,Seychelles,Saint Lucia,Saint Lucia
Which of these is the name of a famous cartoon chipmunk?,Mickey,Goofy,Alvin,Alvin
"According to an old saying, You can't judge a book by its' what?",Index,Klout Score,Cover,Cover
Which machine would you most likely find in a gym?,Karaoke machine,Deep fryer,Treadmill,Treadmill
"Rumored to be made of unicorn horns, the throne chair of Denmark is actually made of what?",Horse bones,White quartz,Narwhal tusks,Narwhal tusks
"What is a derisive name for a large, generic suburban home?",Piazza Hut,Burger Realm,McMansion,McMansion
The Swiss Open has twice given out which of these to a top tennis player?,Giant cheese wheel,Tuft of Swiss grass,Cow,Cow
A single piece of clothing that covers the entire body is called what?,Whatsie,Whosie,Onesie,Onesie
The acclaimed author of The Year of Magical Thinking' has appeared in ads for what fashion brand?,Givenchy,Chanel,C\xc3\xa9line,C\xc3\xa9line
Which island purportedly inspired the setting for Shakespeare's The Tempest'?,Montserrat,Anguilla,Bermuda,Bermuda
Which of these words is NOT part of the diving acronym SCUBA?,Apparatus,Contained,Sport,Sport
Which of these is NOT part of the modern version of the Hippocratic Oath?,Secret-keeping,Respect for physicians,Punctuality,Punctuality
What type of grinning animal is famously featured in Alice's Adventures in Wonderland'?,Pig,Lizard,Cat,Cat
Which of these shows typically features voiceover narration instead of an on-screen host?,Flip or Flop,Fixer Upper,House Hunters,House Hunters
Denver's Union Station once banned which of these things?,Whistling,Wearing red,Kissing,Kissing
Which of these creatures is NOT represented by a professional Japanese baseball team?,Dragon,Carp,Lizard,Lizard
"In the film version of Matilda,' which Olympic sport did Miss Trunchbull compete in?",Pole vault,Fencing,Javelin,Javelin
The 20th century US Supreme Court Justice Marshall was born with what first name?,Thoroughly,Thergood,Thoroughgood,Thoroughgood
Which of these is most likely to cause hair static?,Peeling an orange,Eating too much tuna,Taking off a sweater,Taking off a sweater
Which of these would a doctor most likely make use of?,Clinopinacoid,Xiphiplastron,Armamentarium,Armamentarium
What shape best describes the USDA's current diagram of a balanced diet?,Square,Pyramid,Circle,Circle
Which of these scientists has a common tie knot named in his honor?,Ernest Rutherford,Joseph Priestley,Lord Kelvin,Lord Kelvin
Meat Loaf's album Bat Out of Hell' features songs originally written for a musical about who?,James Dean,Dracula,Peter Pan,Peter Pan
The Golden Glove is a US prize given out to top performers in what sport?,Bowling,UFC,Boxing,Boxing
NASA's Curiosity Rover was built to explore the surface of what?,The moon,Jupiter,Mars,Mars
Which of these words is a synonym for unstable'?,Trickle,Sickle,Fickle,Fickle
Which of these celebrities is NOT mentioned by name in LFO's Summer Girls'?,Michael J. Fox,Macaulay Culkin,Vanilla Ice,Vanilla Ice
The longest side of a right triangle is called the what?,Hypotension,Hypothalamus,Hypotenuse,Hypotenuse
A catchy song is sometimes referred to as what?,Hair tarantula,Face-spider,Earworm,Earworm
"In the children's book, which of these foods did The Very Hungry Caterpillar' eat?",Banana,Pizza,Cupcake,Cupcake
Which of these US states does NOT have a sales tax?,Ohio,Oklahoma,Oregon,Oregon
"According to lore, what did the Sphinx ask for before allowing visitors into Thebes?",Offer a gift,Pay a toll,Answer a riddle,Answer a riddle
The camera was first featured in which iPhone model?,iPhone 3GS,iPhone 3G,First generation iPhone,First generation iPhone
What is the term for illegally crossing the street while not at a crosswalk?,Joewalking,Mikewalking,Jaywalking,Jaywalking
"When the US dollar currency was created, what was its value pegged to?",Price of gold,French franc,Spanish silver dollar,Spanish silver dollar
"According to the author of Harry Potter,' where is Hogwarts?",Ireland,England,Scotland,Scotland
"Of the following cities, which is farthest west?",Los Angeles,Boise,Reno,Reno
Which of these awards is given to the NBA's best first-year player?,America's Cup,Independent Spirit Award,Rookie of the Year,Rookie of the Year
Which show did NOT feature a main cast member who played one of Jerry's girlfriends on Seinfeld'?,Friends,Gilmore Girls,Wings,Wings
"When ranking the seven continents by population, which is in the exact middle?",Europe,South America,North America,North America
In which discipline are you most likely to learn about morphemes?,Nuclear chemistry,Marine biology,Linguistics,Linguistics
What does the S' stand for in the government agency TSA?,Screening,Safety,Security,Security
